{
  "schema_version": "data-catalog-v1",
  "batch_id": "cb36617444fc34224ea1a908d2c071fc0e63914089e3bbff1a04e708c444c2ca",
  "contract_url": "/schemas/data-catalog.schema.json",
  "generated_at": "2026-10-19T06:46:54Z",
  "datasets": [
    {
      "dataset_id": "garden-recommendations",
      "role": "production",
      "market": "CN",
      "schema_version": "legacy-unversioned",
      "observation_date": "2026-10-19",
      "generated_at": "2026-10-19 14:46:54 CST",
      "completeness": {
        "status": "unknown",
        "ratio": null,
        "observed": null,
        "expected": null,
        "reason": "dataset does not publish a comparable observed/expected count"
      },
      "degradation": {
        "status": "unknown",
        "reasons": [
          "dataset does not publish a comparable observed/expected count"
        ]
      },
      "source_categories": [
        "market_data",
        "derived_research"
      ],
      "semantic_sha256": "1bef52d28452120bab50562996a3b2277d730b506871d69689508be0e0e34f6e",
      "sha256": "3ab8416b2e5abb540b6e66eb487092b548cd39f59f93fa58a709265fb7f8964c",
      "bytes": 18993,
      "public_url": "/data/garden-recommendations.json"
    },
    {
      "dataset_id": "a-compass-dashboard",
      "role": "export",
      "market": "CN",
      "schema_version": "a-compass-dashboard-v1",
      "observation_date": "2026-10-16",
      "generated_at": "2026-10-19 08:30:44 UTC+08:00",
      "completeness": {
        "status": "known",
        "ratio": 1.0,
        "observed": 91,
        "expected": 91,
        "reason": null
      },
      "degradation": {
        "status": "normal",
        "reasons": []
      },
      "source_categories": [
        "market_data",
        "derived_research"
      ],
      "semantic_sha256": "e23086a011f32104c508fe93034a56cd897559d325593afea7d623a14b5e0ab9",
      "sha256": "1a8acc515bb7f6736762f8cceab3fbd7788adf23fbacc3a8e7b2c2c9e88f54e6",
      "bytes": 76168,
      "public_url": "/data/a-compass-dashboard.json"
    },
    {
      "dataset_id": "etf-garden-pool",
      "role": "runtime",
      "market": "CN",
      "schema_version": "legacy-unversioned",
      "observation_date": "2026-10-16",
      "generated_at": "2026-10-19 08:30:44 UTC+08:00",
      "completeness": {
        "status": "known",
        "ratio": 1.0,
        "observed": 91,
        "expected": 91,
        "reason": null
      },
      "degradation": {
        "status": "normal",
        "reasons": []
      },
      "source_categories": [
        "market_data",
        "derived_research"
      ],
      "semantic_sha256": "baa1ed6d570f249f64d82e3e269592e801541132c25b998e6698806f6ff4cd83",
      "sha256": "afa3d9f9f32b044e954d93ffa117367bbc53d0e83f436b0968525d7b4e30db78",
      "bytes": 456147,
      "public_url": "/data/etf-garden-pool.json"
    },
    {
      "dataset_id": "a-share-mid-macro",
      "role": "production",
      "market": "CN",
      "schema_version": "a-share-mid-macro-v2",
      "observation_date": "2026-10-19",
      "generated_at": "2026-10-19 14:46:54 CST",
      "completeness": {
        "status": "unknown",
        "ratio": null,
        "observed": null,
        "expected": null,
        "reason": "dataset does not publish a comparable observed/expected count"
      },
      "degradation": {
        "status": "unknown",
        "reasons": [
          "dataset does not publish a comparable observed/expected count"
        ]
      },
      "source_categories": [
        "market_data",
        "official_statistics",
        "derived_research"
      ],
      "semantic_sha256": "0eb6e08c75fffe20c1d20f9f9f5287bb150a1281413fb7f3a87f8d0ad2d6f961",
      "sha256": "24d5c855496041dc9add46716b617f5fcb3109e4228dde07bbb42b91dee0d1fb",
      "bytes": 23348,
      "public_url": "/data/a-share-mid-macro.json"
    },
    {
      "dataset_id": "a-share-research-audit",
      "role": "shadow",
      "market": "CN",
      "schema_version": "research_audit_v1",
      "observation_date": "2026-10-16",
      "generated_at": "2026-10-19T14:46:51.461940+08:00",
      "completeness": {
        "status": "unknown",
        "ratio": null,
        "observed": null,
        "expected": null,
        "reason": "dataset does not publish a comparable observed/expected count"
      },
      "degradation": {
        "status": "unknown",
        "reasons": [
          "dataset does not publish a comparable observed/expected count"
        ]
      },
      "source_categories": [
        "historical_market_data",
        "derived_research"
      ],
      "semantic_sha256": "5f5eb539d07ada3c5b75b447069fafa03cc7e3df62ef53a03ff8ee3252bc9028",
      "sha256": "a66f034c3bd80aa557d232467954bc3eeebf830fd1b7acff271b1df7d963afbd",
      "bytes": 8310,
      "public_url": "/data/model-lab/a-share-research-audit.json"
    },
    {
      "dataset_id": "investment-research-layer",
      "role": "shadow",
      "market": "MULTI",
      "schema_version": "investment-research-layer-v1",
      "observation_date": "2026-07-27",
      "generated_at": "2026-07-27T00:05:18+08:00",
      "completeness": {
        "status": "unknown",
        "ratio": null,
        "observed": null,
        "expected": null,
        "reason": "dataset does not publish a comparable observed/expected count"
      },
      "degradation": {
        "status": "unknown",
        "reasons": [
          "dataset does not publish a comparable observed/expected count"
        ]
      },
      "source_categories": [
        "derived_research"
      ],
      "semantic_sha256": "b6d8f37d41fb4b74031b6295fa6b1ea62c394fb3233f471ef2c7e95f86c05a9f",
      "sha256": "c7f3fbfc00849566f23828cba99d1bc0b8c8d2d117492af05a505249563c71c1",
      "bytes": 4412,
      "public_url": "/data/research/investment-research-layer.json"
    },
    {
      "dataset_id": "a-share-path-shadow",
      "role": "shadow",
      "market": "CN",
      "schema_version": 1,
      "observation_date": "2026-10-16",
      "generated_at": "2026-10-19T00:45:02+00:00",
      "completeness": {
        "status": "unknown",
        "ratio": null,
        "observed": null,
        "expected": null,
        "reason": "dataset does not publish a comparable observed/expected count"
      },
      "degradation": {
        "status": "unknown",
        "reasons": [
          "dataset does not publish a comparable observed/expected count"
        ]
      },
      "source_categories": [
        "historical_market_data",
        "model_output"
      ],
      "semantic_sha256": "5ce59e0803a510e08300dcdc3767c9f2b7f3caea316932eddfcdfdeebfead655",
      "sha256": "8b95e471032119953808718e9b7d0c7e508af485b08e7338792f7dcee3ea90f1",
      "bytes": 74489,
      "public_url": "/data/model-lab/a-share-path-shadow.json"
    },
    {
      "dataset_id": "us-etf-garden",
      "role": "production",
      "market": "US",
      "schema_version": "legacy-unversioned",
      "observation_date": "2026-10-16",
      "generated_at": "2026-10-16T18:30:21.223452-04:00",
      "completeness": {
        "status": "unknown",
        "ratio": null,
        "observed": null,
        "expected": null,
        "reason": "dataset does not publish a comparable observed/expected count"
      },
      "degradation": {
        "status": "unknown",
        "reasons": [
          "dataset does not publish a comparable observed/expected count"
        ]
      },
      "source_categories": [
        "market_data",
        "derived_research"
      ],
      "semantic_sha256": "393aa5f8cb397474daaabf56990a6042468ebfa6b8b357aec9d55167d5eed066",
      "sha256": "9d40f2bbdb6dee35715ef342577e3d831595a7ee3d7f185b2ba375ecd05e957c",
      "bytes": 15206,
      "public_url": "/data/us-etf-garden.json"
    },
    {
      "dataset_id": "us-etf-pool",
      "role": "runtime",
      "market": "US",
      "schema_version": "legacy-unversioned",
      "observation_date": "2026-10-16",
      "generated_at": "2026-10-16T18:30:21.223452-04:00",
      "completeness": {
        "status": "known",
        "ratio": 1.0,
        "observed": 74,
        "expected": 74,
        "reason": null
      },
      "degradation": {
        "status": "normal",
        "reasons": []
      },
      "source_categories": [
        "market_data",
        "derived_research"
      ],
      "semantic_sha256": "1481dcfa1101e2e7de0e5b599f878e9d9d2e48c3abf48fec8d64ca0c79198e59",
      "sha256": "134b84f1f21585485aeef35680bb3d68c9416a55752ae37baa566bae1badb793",
      "bytes": 75545,
      "public_url": "/data/us-etf-pool.json"
    },
    {
      "dataset_id": "us-macro-dashboard",
      "role": "production",
      "market": "US",
      "schema_version": "us-macro-dashboard-v2",
      "observation_date": "2026-10-16",
      "generated_at": "2026-10-16T18:32:30.252751-04:00",
      "completeness": {
        "status": "unknown",
        "ratio": null,
        "observed": null,
        "expected": null,
        "reason": "dataset does not publish a comparable observed/expected count"
      },
      "degradation": {
        "status": "degraded",
        "reasons": [
          "3 public source observations unavailable"
        ]
      },
      "source_categories": [
        "market_data",
        "official_statistics",
        "public_events"
      ],
      "semantic_sha256": "87556c3cb7b864ddf283a242818b075bc885e41571d431890ed7a58e7dd4d2b4",
      "sha256": "ff7ac9c06a59620195986366dcf54538f42a86b78a1e50dce3e09943fb6fc889",
      "bytes": 16021,
      "public_url": "/data/us-macro-dashboard.json"
    },
    {
      "dataset_id": "us-compass-research",
      "role": "history",
      "market": "US",
      "schema_version": "us-compass-research-v2",
      "observation_date": "2026-10-16",
      "generated_at": "2026-10-17T01:00:11.574531+00:00",
      "completeness": {
        "status": "unknown",
        "ratio": null,
        "observed": null,
        "expected": null,
        "reason": "dataset does not publish a comparable observed/expected count"
      },